{
  "schema": "company-os.release-scope-admission-verification.v1",
  "ok": true,
  "project_id": "example-project",
  "program_id": "example-program",
  "program_version": 1,
  "definition_version": 1,
  "cycle_id": "example-cycle-1",
  "admission_verification_path": "evidence/release-scope-admission-verification.v1.json",
  "scope_definition_sha256": "0000000000000000000000000000000000000000000000000000000000000000",
  "scope_contract_sha256": "0000000000000000000000000000000000000000000000000000000000000000",
  "registry_record_sha256": "0000000000000000000000000000000000000000000000000000000000000000",
  "scope_admission": {
    "path": "evidence/release-scope-admission.v1.json",
    "sha256": "0000000000000000000000000000000000000000000000000000000000000000"
  },
  "accepted_design_decision": {
    "path": "evidence/release-scope-design-decision.v1.json",
    "sha256": "0000000000000000000000000000000000000000000000000000000000000000"
  },
  "master_public_key_sha256": "0000000000000000000000000000000000000000000000000000000000000000"
}
